<?xml version="1.0" encoding="UTF-8"?>
<list-view xmlns:xsi="http://www.w3.org/2001/XMLSchema-instance" xsi:noNamespaceSchemaLocation="list-view.xsd"
           unassigned-group-name="Other">
	<group name="General">
		<custom spring-bean="CmsComponentIconColumn" name=" " visible="true" selectable="true" width="28px"/>
		<custom spring-bean="CmsComponentStatusColumn" name=" " visible="true" selectable="true" width="12px">
			<renderer class="de.hybris.platform.cmscockpit.components.listview.impl.CmsComponentStatusActionCellRenderer"/>
		</custom>
		<property qualifier="cmsitem.name" visible="true" width="130px">
			<renderer class="de.hybris.platform.cmscockpit.components.listview.impl.CmsComponentTextCellRenderer"/>
		</property>
		<custom spring-bean="CatalogAbstractContentElementSectionListActionColumn" name="Actions" visible="true" selectable="true" width="95px"/>
	</group>
</list-view>