<?xml version="1.0" encoding="UTF-8"?>
<list-view xmlns:xsi="http://www.w3.org/2001/XMLSchema-instance" xsi:noNamespaceSchemaLocation="list-view.xsd"
           unassigned-group-name="Other">
	<group name="General">
		<custom class="de.hybris.platform.cockpit.services.config.impl.LineNumberColumn" name="Line nr" visible="false" selectable="true" width="70px"/>
		<property qualifier="cmsitem.name" visible="true" width="350px"/>
		<property qualifier="cmsitem.uid" visible="false"/>
		<property qualifier="cmsitem.catalogVersion" visible="false"  editor="shortListEditor"/>
		<property qualifier="abstractpage.defaultPage" visible="true" />
		<property qualifier="abstractpage.masterTemplate" visible="true"/>
		<property qualifier="ContentPage.label" visible="true"/>
		</group>
</list-view>